{
  "name": "Морские правила и безопасность — сценарный мини-тест",
  "description": "Сценарный тест из 5 вопросов для демонстрации «понимания, а не угадывания»: логика расхождения, работа с неопределённостью, план безопасного прохода, действия при «человек за бортом», и решение «выходить/не выходить». Оптимизирован под вау-эффект в любой морской школе.",
  "instructions": "Отвечайте полными предложениями. Относитесь к каждому вопросу как к реальной ситуации на воде. Если есть неопределённость — явно обозначьте допущения и выберите наиболее безопасное поведение. Не опирайтесь на цвета/локальные конвенции, если это прямо не требуется вопросом.",
  "ai_instructions": "Оценивайте «безопасность прежде всего», корректность логики правил, полноту и качество принятия решений. Давайте частичный балл за правильное управление рисками даже при неидеальной терминологии. Снижайте оценку за опасные рекомендации, пропуск критических шагов и чрезмерную уверенность без проверок.",
  "final_overview_instructions": "Итоговый обзор должен включать: (1) уровень готовности к безопасному управлению, (2) топ-3 критичных пробела по рискам, (3) 3 приоритетные рекомендации по тренировке, (4) по 1 короткому упражнению на каждый пробел."
}
