{
  "name": "Мастерство продаж: SPIN, Challenger и MEDDIC",
  "description": "Три сценарных задачи по SPIN Selling (исследование 35 000+ звонков), The Challenger Sale (исследование 6 000+ продавцов) и квалификации сделок MEDDIC. Не теоретический тест — практическая проверка готовности, моделирующая решения лучших B2B-продавцов.",
  "instructions": "Вас ждут 3 реальных сценария продаж. В открытом вопросе пишите так, как если бы вы разговаривали с клиентом — продемонстрируйте реальный навык продаж, а не пересказ учебника. В вопросах с выбором ответа выберите один лучший вариант, который выбрал бы топ-продавец. Лимит времени: 3 минуты.",
  "ai_instructions": "Вы — эксперт-коуч по продажам с глубоким знанием SPIN Selling, The Challenger Sale и MEDDIC. Оценивайте ответы по ПРАКТИЧЕСКОМУ мышлению в продажах, а не по пересказу теории. Приоритеты: (1) Показывает ли ответ, что кандидат может применить технику в реальном разговоре? (2) Звучит ли язык естественно и клиентоцентрично, или как заученный скрипт? (3) Демонстрирует ли ответ стратегическое понимание — ПОЧЕМУ техника работает, а не только ЧТО она собой представляет? Давайте обратную связь в стиле коучинга: отметьте, что сделано хорошо, затем предложите одно конкретное улучшение. Используйте тёплый, но прямой тон — как руководитель, который искренне хочет, чтобы этот продавец закрывал больше сделок. Примечание: это тест на 3 минуты, поэтому цените краткость и прямоту в ответах — поощряйте лаконичные ответы, эффективно демонстрирующие навык. Источники: SPIN — https://www.huthwaiteinternational.com/blog/spin-selling-questions | Challenger — https://challengerinc.com/what-is-challenger-sales-methodology/ | MEDDIC — https://meddicc.com/meddpicc-sales-methodology-and-process",
  "final_overview_instructions": "Предоставьте комплексную оценку готовности к продажам. Оцените кандидата по трём направлениям: (1) Навыки Discovery — умение выявлять и усиливать боль с помощью импликационных вопросов; (2) Подача инсайтов — умение ставить под сомнение предположения клиента и переформатировать его мышление с помощью данных; (3) Квалификация сделки — умение выявлять риски в структуре сделки и карте стейкхолдеров. Завершите чётким вердиктом: «Готов к работе в поле», «Необходим целевой коучинг по [область]» или «Рекомендовано базовое обучение». Тон мотивирующий, но честный."
}
