{
  "name": "Мини-тест по основам ИИ",
  "description": "Короткий тест из 5 вопросов по базовым концепциям ИИ/ML, основам LLM и практическим вопросам безопасности.",
  "instructions": "Отвечайте внимательно. В открытых вопросах пишите полными предложениями и приводите конкретные примеры, где это требуется.",
  "ai_instructions": "Оценивайте по фактической точности, ясности и полноте. Давайте частичный балл за верное рассуждение, даже если терминология неидеальна."
}
