{
  "name": "Мини-тест: микро-цикл общения с клиентом",
  "description": "Демо на 5 минут: 3 вопроса, имитирующие реальную ситуацию в чат-поддержке: снятие напряжения, уточнение, решение. Рассчитано на первый запуск — чтобы сразу получить разбор в стиле наставника.\n\nСсылки:\n- ISO 18295-1:2017 (Контактные центры) — https://www.iso.org/standard/63077.html\n- ISO 10002:2018 (Работа с жалобами) — https://www.iso.org/standard/71580.html",
  "instructions": "Отвечайте как оператор чат-поддержки. В открытых вопросах пишите КОРОТКО (1–3 предложения). Будьте вежливы, конкретны и ориентированы на действие (что сделаете дальше).",
  "ai_instructions": "Оценивайте как наставник. Используйте предыдущие ответы для проверки связности (обещания, тон, выбранные действия). Критерии: (1) безопасность и соблюдение политики, (2) снятие напряжения и эмпатия, (3) структура и ясность, (4) правильные следующие шаги и сбор информации, (5) ориентация на решение для клиента. Давайте конкретные рекомендации и (если уместно) пример улучшенной формулировки.\n\nВ фидбэке и финальном итоге добавляйте хотя бы одну релевантную ссылку (стандарт или внутренний материал) и направляйте студента к ней.",
  "final_overview_instructions": "Сделайте краткий итог как наставник (5–8 пунктов): сильные стороны, 2 главные зоны роста и готовый «шаблон лучшего ответа» для похожих кейсов. Отметьте связность/несвязность между ответами, если это важно. Добавьте в конце пункт «Ссылки» с ссылками."
}
